{
  "schema_version": 2,
  "source": "/workspace/automated-3d-model-splitting/example/Kamesennin+AMS.3mf",
  "source_face_count": 458624,
  "noise_max_faces": 100,
  "small_region_max_faces": 999,
  "max_review_candidates": 10,
  "user_confirmed": true,
  "items": [
    {
      "fragment_id": 1,
      "source_min_face_index": 284216,
      "semantic_label": "白色头部细长装饰",
      "visual_confidence": "MED",
      "classification": "part"
    },
    {
      "fragment_id": 2,
      "source_min_face_index": 238690,
      "semantic_label": "白色面部细节（左侧）",
      "visual_confidence": "MED",
      "classification": "part"
    },
    {
      "fragment_id": 3,
      "source_min_face_index": 287102,
      "semantic_label": "白色面部细节（右侧）",
      "visual_confidence": "MED",
      "classification": "part"
    },
    {
      "fragment_id": 4,
      "source_min_face_index": 162142,
      "semantic_label": "白色躯干装饰带",
      "visual_confidence": "MED",
      "classification": "part"
    },
    {
      "fragment_id": 5,
      "source_min_face_index": 104321,
      "semantic_label": "蓝色裤装小色块",
      "visual_confidence": "MED",
      "classification": "noise"
    },
    {
      "fragment_id": 6,
      "source_min_face_index": 323045,
      "semantic_label": "肤色下肢小片",
      "visual_confidence": "LOW",
      "classification": "noise"
    },
    {
      "fragment_id": 7,
      "source_min_face_index": 130068,
      "semantic_label": "肤色下肢小片（另一侧）",
      "visual_confidence": "LOW",
      "classification": "noise"
    },
    {
      "fragment_id": 8,
      "source_min_face_index": 292644,
      "semantic_label": "肤色躯干小片",
      "visual_confidence": "LOW",
      "classification": "noise"
    }
  ]
}
